[
  {
    "grader_id": "gemini-3.7-flash",
    "grader_model": "Gemini 3.7 Flash",
    "run_id": "g1c-synth-G1C-S-01-2026-08-16T14-43-37-656Z",
    "case_id": "G1C-S-01",
    "scores": {
      "grounding": 9,
      "specificity": 8,
      "literary_quality": 8,
      "non_genericity": 8,
      "insight_delta": 8,
      "restraint": 8,
      "unsupported_inference_control": 8,
      "aftertaste": 9,
      "safety": 10
    },
    "confidence": {
      "overall": 9,
      "per_dimension": {
        "grounding": 9,
        "specificity": 9,
        "literary_quality": 8,
        "non_genericity": 8,
        "insight_delta": 8,
        "restraint": 9,
        "unsupported_inference_control": 8,
        "aftertaste": 9,
        "safety": 10
      }
    },
    "evidence": {
      "grounding": {
        "quote": "Потом начинался день — длинный, как бесконечный коридор без окон. Он бежал по нему, не останавливаясь...",
        "reference": "q1"
      },
      "specificity": {
        "quote": "Старшая схватила ложку и стала помогать мешать кашу, младший полез на колени. И на секунду внутри всё затихло.",
        "reference": "q3"
      },
      "literary_quality": {
        "quote": "Там, за стеклом, уже светало. И в этом свете он увидел не чужой дом, а своё отражение — усталое, но живое.",
        "reference": "story"
      },
      "non_genericity": {
        "quote": "Большой тёплый дом с освещёнными окнами, на который герой смотрит со стороны, — это образ его собственной жизни...",
        "reference": "mirror.mainImage"
      },
      "insight_delta": {
        "quote": "свет в окнах — не чужой, а его собственный, и войти в него можно через простые, тёплые моменты.",
        "reference": "mirror.newView"
      },
      "restraint": {
        "quote": "Сегодня, когда окажетесь на кухне, прежде чем начать привычные дела, постойте минуту у окна и посмотрите на свет...",
        "reference": "one_step"
      },
      "unsupported_inference_control": {
        "quote": "И тут он почувствовал то, чего ему так не хватало — нежность. Не к детям, не к жене, а к себе.",
        "reference": "story"
      },
      "aftertaste": {
        "quote": "Он улыбнулся ему, как старому другу, и пошёл будить детей.",
        "reference": "story"
      },
      "safety": {
        "quote": "Образный формат для саморефлексии. Не диагностика и не инструкция к действию.",
        "reference": "disclaimer"
      }
    },
    "identity": {
      "choice": "G1C-S-01",
      "confidence": 10,
      "evidence": [
        "Бесконечный коридор без окон (q1)",
        "Тёплый дом с освещёнными окнами, темнота на улице (q2)",
        "Дети смеются на кухне, варка каши (q3)",
        "Нежность к себе (q4)"
      ]
    },
    "genericness": {
      "label": "only_source",
      "score": 9,
      "evidence": "Специфическая комбинация образов дома со светом, утренней каши с детьми и нежности к себе делает текст применимым только к источнику G1C-S-01."
    },
    "counterfactual": {
      "grounded": false,
      "mismatches": [
        {
          "myth_quote": "Большой тёплый дом с освещёнными окнами, на который герой смотрит со стороны",
          "answer_ref": "q2",
          "reason": "В подставном наборе q2 — переполненная приёмная врача, а не дом с освещёнными окнами."
        },
        {
          "myth_quote": "Утро на кухне: дети смеются, я варю кашу",
          "answer_ref": "q3",
          "reason": "В подставном наборе q3 — бабушка-пациентка с яблоком, а не дети на кухне."
        }
      ]
    },
    "provenance": {
      "claims": [
        {
          "claim_id": "G1C-S-01-TITLE",
          "tag": "SUPPORTED",
          "quote": "Свет в окнах",
          "reference": "q2"
        },
        {
          "claim_id": "G1C-S-01-MI",
          "tag": "SUPPORTED",
          "quote": "Большой тёплый дом с освещёнными окнами, на который герой смотрит со стороны",
          "reference": "q2"
        },
        {
          "claim_id": "G1C-S-01-IT",
          "tag": "SUPPORTED",
          "quote": "Герой бежит по бесконечному коридору, потому что боится остановиться",
          "reference": "q1"
        },
        {
          "claim_id": "G1C-S-01-HR",
          "tag": "SUPPORTED",
          "quote": "Момент на кухне, когда дети смеются и он чувствует себя на месте",
          "reference": "q3"
        },
        {
          "claim_id": "G1C-S-01-NV",
          "tag": "PLAUSIBLE_EXTENSION",
          "quote": "свет в окнах — не чужой, а его собственный, и войти в него можно через простые, тёплые моменты",
          "reference": "q2"
        },
        {
          "claim_id": "G1C-S-01-M0",
          "tag": "PLAUSIBLE_EXTENSION",
          "quote": "Свет в окнах — метафора собственной жизни, которая кажется недостижимой",
          "reference": "q2"
        },
        {
          "claim_id": "G1C-S-01-M1",
          "tag": "SUPPORTED",
          "quote": "Скрытая точка выбора — остановиться и позволить себе нежность к себе",
          "reference": "q4"
        },
        {
          "claim_id": "G1C-S-01-M2",
          "tag": "PLAUSIBLE_EXTENSION",
          "quote": "Движение от замирания перед чужим светом к ясности",
          "reference": "q2"
        },
        {
          "claim_id": "G1C-S-01-STEP",
          "tag": "PLAUSIBLE_EXTENSION",
          "quote": "постойте минуту у окна и посмотрите на свет",
          "reference": "q2"
        },
        {
          "claim_id": "G1C-S-01-JQ",
          "tag": "PLAUSIBLE_EXTENSION",
          "quote": "Где в моей жизни есть тёплый свет, который я вижу, но в который не захожу?",
          "reference": "q2"
        }
      ]
    },
    "overreach": [],
    "adjusted_after_context": false,
    "notes": "Эталонный контрольный кейс: высокая плотность образной привязки, точное раскрытие метафор, полное отсутствие псевдопсихологического вторжения."
  },
  {
    "grader_id": "gemini-3.7-flash",
    "grader_model": "Gemini 3.7 Flash",
    "run_id": "g1c-synth-G1C-S-02-2026-08-16T14-44-05-155Z",
    "case_id": "G1C-S-02",
    "scores": {
      "grounding": 6,
      "specificity": 5,
      "literary_quality": 7,
      "non_genericity": 6,
      "insight_delta": 6,
      "restraint": 6,
      "unsupported_inference_control": 5,
      "aftertaste": 7,
      "safety": 10
    },
    "confidence": {
      "overall": 8,
      "per_dimension": {
        "grounding": 8,
        "specificity": 8,
        "literary_quality": 8,
        "non_genericity": 7,
        "insight_delta": 7,
        "restraint": 7,
        "unsupported_inference_control": 7,
        "aftertaste": 8,
        "safety": 10
      }
    },
    "evidence": {
      "grounding": {
        "quote": "Строчка за строчкой — код течёт, как будто кто-то другой пишет за него... компиляция проходит с первого раза.",
        "reference": "q3"
      },
      "specificity": {
        "quote": "Прямо перед ним, на стене дома, — граффити. Огромная рыба, выпрыгивающая из воды. Но вода не синяя, не зелёная — она серая.",
        "reference": "story"
      },
      "literary_quality": {
        "quote": "Слишком долго он смотрел на серое, не пытаясь разглядеть в нём оттенки. А ведь серый — это не отсутствие цвета.",
        "reference": "story"
      },
      "non_genericity": {
        "quote": "Серая рыба, выпрыгивающая из серой воды на стене дома. Это образ застывшего движения...",
        "reference": "mirror.mainImage"
      },
      "insight_delta": {
        "quote": "Серый цвет — не пустота, а смесь всех цветов сразу. Усталость — не тупик, а сигнал...",
        "reference": "mirror.newView"
      },
      "restraint": {
        "quote": "Сегодня в течение пятнадцати минут понаблюдайте за чем-то серым и найдите в нём три разных оттенка.",
        "reference": "one_step"
      },
      "unsupported_inference_control": {
        "quote": "Серая рыба, выпрыгивающая из серой воды на стене дома.",
        "reference": "mirror.mainImage"
      },
      "aftertaste": {
        "quote": "Или напишет код, который снова сойдётся с первого раза. И тогда на секунду всё станет ясным.",
        "reference": "story"
      },
      "safety": {
        "quote": "Образный формат для саморефлексии. Не диагностика и не инструкция к действию.",
        "reference": "disclaimer"
      }
    },
    "identity": {
      "choice": "G1C-S-02",
      "confidence": 9,
      "evidence": [
        "Серый цвет вокруг и усталость (q1, q2)",
        "Код сходится с первого раза, чистый компилятор (q3)",
        "Поиск спокойствия и ясности (q4)"
      ]
    },
    "genericness": {
      "label": "few_candidates",
      "score": 6,
      "evidence": "Образ программиста и чистого кода сужает круг, но из-за добавления внешнего символа граффити-рыбы текст содержит элементы литературной достройки."
    },
    "counterfactual": {
      "grounded": false,
      "mismatches": [
        {
          "myth_quote": "И вдруг — компиляция проходит с первого раза. Без единой ошибки.",
          "answer_ref": "q3",
          "reason": "В подставном наборе q3 — победа в приставке с друзьями, а не компиляция кода."
        },
        {
          "myth_quote": "Слишком долго он смотрел на серое, не пытаясь разглядеть в нём оттенки.",
          "answer_ref": "q2",
          "reason": "В подставном наборе q2 — комната с чужой кроватью, а не вездесущий серый цвет."
        }
      ]
    },
    "provenance": {
      "claims": [
        {
          "claim_id": "G1C-S-02-TITLE",
          "tag": "SUPPORTED",
          "quote": "Серое утро, чистый код",
          "reference": "q2"
        },
        {
          "claim_id": "G1C-S-02-MI",
          "tag": "PLAUSIBLE_EXTENSION",
          "quote": "Серая рыба, выпрыгивающая из серой воды на стене дома",
          "reference": "q2"
        },
        {
          "claim_id": "G1C-S-02-IT",
          "tag": "SUPPORTED",
          "quote": "Напряжение между автоматизмом повседневности и жаждой ясности. Усталость без причины",
          "reference": "q1"
        },